{
  "$schema": "../docs/bottle_design.schema.json",
  "bottle": "beer",
  "glass": {
    "tint": [
      0.25,
      0.14,
      0.03,
      1.0
    ]
  },
  "cap": {
    "type": "crown"
  },
  "liquid": {
    "color": [
      0.85,
      0.52,
      0.06,
      1.0
    ],
    "fill": 0.8,
    "carbonation": 0.45,
    "foam": 1.0,
    "opacity": 0.6,
    "viscosity": 0.1,
    "density": 1.01,
    "bubble_size": 0.9
  },
  "labels": [
    {
      "slot": "front",
      "image": "labels/beer_pale_front.png"
    },
    {
      "slot": "neck",
      "image": "labels/beer_pale_neck.png"
    }
  ],
  "meta": {
    "description": "Body label + neck label on a brown beer bottle.",
    "tags": [
      "beer",
      "neck"
    ],
    "name": "beer_pale",
    "licence": "CC0 / MIT - original art, fictional brands"
  }
}