{
  "$schema": "../docs/bottle_design.schema.json",
  "bottle": "beer",
  "glass": {
    "tint": [
      0.22,
      0.12,
      0.02,
      1.0
    ]
  },
  "cap": {
    "type": "crown",
    "colour": "#b8862a"
  },
  "liquid": {
    "color": [
      0.7,
      0.32,
      0.04,
      1.0
    ],
    "fill": 0.8,
    "carbonation": 0.5,
    "foam": 0.9,
    "opacity": 0.7,
    "viscosity": 0.1,
    "density": 1.01
  },
  "labels": [
    {
      "slot": "wrap",
      "image": "labels/beer_amber_wrap.png"
    }
  ],
  "meta": {
    "description": "Full 360 degree wrap label, seam at the back.",
    "tags": [
      "beer",
      "wrap"
    ],
    "name": "beer_wrap",
    "licence": "CC0 / MIT - original art, fictional brands"
  }
}