{
  "$schema": "../docs/bottle_design.schema.json",
  "bottle": "whiskey",
  "glass": {
    "tint": [
      0.85,
      0.92,
      0.88,
      1.0
    ]
  },
  "cap": {
    "type": "cork"
  },
  "liquid": {
    "color": [
      0.62,
      0.3,
      0.04,
      1.0
    ],
    "fill": 0.7,
    "opacity": 0.9,
    "viscosity": 0.25,
    "density": 0.94,
    "tint_strength": 1.3
  },
  "labels": [
    {
      "slot": "front",
      "image": "labels/whiskey_classic_front.png"
    },
    {
      "slot": "back",
      "image": "labels/whiskey_classic_back.png"
    },
    {
      "slot": "neck",
      "image": "labels/whiskey_neck_tag.png",
      "wear_mask": "labels/whiskey_neck_tag_wear.png"
    }
  ],
  "meta": {
    "description": "Front, back and a handwritten kraft neck tag.",
    "tags": [
      "whiskey",
      "tag",
      "handwritten"
    ],
    "name": "whiskey_tag",
    "licence": "CC0 / MIT - original art, fictional brands"
  }
}