{
  "$schema": "../docs/bottle_design.schema.json",
  "asset": "v2_perfume",
  "liquid": {
    "color": [
      0.95,
      0.8,
      0.78,
      1
    ],
    "fill": 0.7,
    "carbonation": 0.0,
    "foam": 0.0
  },
  "labels": [
    {
      "slot": "front",
      "generate": {
        "template": "perfume",
        "seed": 91,
        "wear": 0.05
      }
    }
  ],
  "meta": {
    "description": "Perfume bottle with a small gold-bordered front label.",
    "tags": [
      "perfume",
      "v2"
    ],
    "name": "v2_perfume_atelier",
    "licence": "CC0 / MIT - original art, fictional brands"
  }
}